{
  "site": "http://demo.example.com/",
  "audited_at": "2026-09-11T03:48:30Z",
  "auditor": {
    "name": "brand-evidence-auditor",
    "version": "1.0.0",
    "user_agent": "BrandEvidenceAuditor/1.0 (read-only site audit; respects robots.txt; contact: site owner)"
  },
  "scope": {
    "type": "site",
    "status": "partial",
    "pages_examined": 13,
    "pages_readable": 12,
    "requests_made": 17,
    "duration_seconds": 0.4,
    "urls_examined": [
      "http://demo.example.com/",
      "http://demo.example.com/product-blender.html",
      "http://demo.example.com/blog/news-one.html",
      "http://demo.example.com/blog/news-two.html",
      "http://demo.example.com/app-shell.html",
      "http://demo.example.com/catalog.html",
      "http://demo.example.com/city-picker.html",
      "http://demo.example.com/copy-a.html",
      "http://demo.example.com/copy-b.html",
      "http://demo.example.com/mismatch.html",
      "http://demo.example.com/missing-page.html",
      "http://demo.example.com/offers-archive.html",
      "http://demo.example.com/promo-heavy.html"
    ],
    "rendering_verification": "not performed — no browser engine was used; all pages judged from served HTML"
  },
  "summary": {
    "total_findings": 16,
    "critical": 0,
    "high": 5,
    "medium": 9,
    "low": 2
  },
  "evidence_path": {
    "DISCOVER": {
      "worst_severity": "high",
      "findings": [
        "F-004",
        "F-005",
        "F-010"
      ]
    },
    "IDENTIFY": {
      "worst_severity": "high",
      "findings": [
        "F-002",
        "F-003",
        "F-006",
        "F-011",
        "F-014"
      ]
    },
    "EXTRACT": {
      "worst_severity": "medium",
      "findings": [
        "F-012",
        "F-016"
      ]
    },
    "UNDERSTAND": {
      "worst_severity": "medium",
      "findings": [
        "F-009",
        "F-015"
      ]
    },
    "TRUST": {
      "worst_severity": "high",
      "findings": [
        "F-001",
        "F-007"
      ]
    },
    "CITE": {
      "worst_severity": "medium",
      "findings": [
        "F-013"
      ]
    },
    "ENGAGE": {
      "worst_severity": "medium",
      "findings": [
        "F-008"
      ]
    }
  },
  "external_corroboration": {
    "mode": "auto",
    "performed": true,
    "declared_identifiers": 2,
    "probes_attempted": 2,
    "probes_completed": 2,
    "references_resolved": 1,
    "references_linking_back": 0,
    "independent_descriptions_found": 0,
    "hostname_variants_probed": 0,
    "probes": [
      {
        "url": "http://demo.example.com/profiles/missing.html",
        "declared_in": "sameAs in entity markup on http://demo.example.com/",
        "kind": "reference",
        "checked": true,
        "status": 404,
        "links_back": false,
        "carries_description": false
      },
      {
        "url": "http://demo.example.com/profiles/unrelated.html",
        "declared_in": "sameAs in entity markup on http://demo.example.com/",
        "kind": "reference",
        "checked": true,
        "status": 200,
        "links_back": false,
        "carries_description": false,
        "title": "Riverbend Cycling Club — members page"
      }
    ],
    "hostname_probes": [],
    "scope_note": "Only URLs the site itself declares (sameAs, identifier, rel=me, rel=author, rel=publisher, cross-domain rel=alternate) and the other common form of its own hostname were requested. No search engine, directory or third-party source the site did not name was consulted. No conclusion is drawn from the absence of external references, and no claim is made about how discoverable this brand is on the web at large — the audit has not looked at the web at large."
  },
  "findings": [
    {
      "id": "F-001",
      "defect_id": "FI-003",
      "detector": "structured_data_contradicts_page",
      "title": "Structured data disagrees with the visible page",
      "category": "fact-integrity",
      "stage": "TRUST",
      "failure_mode": "misread",
      "severity": "high",
      "priority": "P0",
      "confidence": 0.88,
      "evidence_level": "corroborated",
      "impact": "A research agent can quote a price, name or availability that the page does not actually show.",
      "mechanism": "Structured data is trusted precisely because it is unambiguous. When JSON-LD asserts a price, name or availability that appears nowhere in the visible text, a system reading the markup extracts a fact the page itself does not support — producing a confidently-stated wrong answer rather than a missing one.",
      "evidence": "http://demo.example.com/product-blender.html: JSON-LD price does not match the visible page [structured value=\"999\"; visible value(s)=\"1299\"]",
      "evidence_items": [
        {
          "url": "http://demo.example.com/product-blender.html",
          "observation": "JSON-LD price does not match the visible page",
          "measurement": "structured value=\"999\"; visible value(s)=\"1299\""
        }
      ],
      "affected_urls": [
        "http://demo.example.com/product-blender.html"
      ],
      "measurements": {
        "pages_with_product_markup": 1,
        "pages_with_mismatch": 1,
        "share": 1.0,
        "fields": [
          "price"
        ],
        "priority_score": 0.5628,
        "affected_surface": 1.0
      },
      "effort": "medium",
      "suggested_action": {
        "summary": "Make price in JSON-LD render from the same source as the visible value on http://demo.example.com/product-blender.html.",
        "implementation": [
          "Bind the JSON-LD field to the same data source that renders the visible value, rather than a separate constant or feed.",
          "Add a build/CI assertion that fails when the serialised markup value differs from the rendered value.",
          "Where the markup is intentionally a starting price, use the correct schema field (e.g. lowPrice within AggregateOffer) and reflect that in the visible copy."
        ],
        "why_it_works": "The contradiction exists because two sources produce the fact independently; binding them to one source removes the class of error rather than one instance.",
        "verification": "Fetch the page, extract the JSON-LD field and the visible value, and confirm they match; re-run the audit.",
        "priority": "P0"
      }
    },
    {
      "id": "F-002",
      "defect_id": "MR-004",
      "detector": "canonical_conflict",
      "title": "Canonical URLs conflict with page identity",
      "category": "machine-readability",
      "stage": "IDENTIFY",
      "failure_mode": "ambiguous",
      "severity": "high",
      "priority": "P0",
      "confidence": 0.9,
      "evidence_level": "verified",
      "impact": "Content is attributed to the wrong URL, or dropped as a duplicate, making a stable citation target impossible.",
      "mechanism": "rel=canonical tells a retrieval system which URL *is* this document. When it points off-site, to a dead URL, or collapses pages with materially different content onto one address, the machine either attributes the content to the wrong address or discards the page as a duplicate — so a citation cannot resolve back to it.",
      "evidence": "http://demo.example.com/: two pages with materially different content declare the same canonical URL [other page=http://demo.example.com/city-picker.html; shared canonical=http://demo.example.com/; main-text similarity=0.00] | http://demo.example.com/city-picker.html: two pages with materially different content declare the same canonical URL [other page=http://demo.example.com/mismatch.html; shared canonical=http://demo.example.com/; main-text similarity=0.00]",
      "evidence_items": [
        {
          "url": "http://demo.example.com/",
          "observation": "two pages with materially different content declare the same canonical URL",
          "measurement": "other page=http://demo.example.com/city-picker.html; shared canonical=http://demo.example.com/; main-text similarity=0.00"
        },
        {
          "url": "http://demo.example.com/city-picker.html",
          "observation": "two pages with materially different content declare the same canonical URL",
          "measurement": "other page=http://demo.example.com/mismatch.html; shared canonical=http://demo.example.com/; main-text similarity=0.00"
        }
      ],
      "affected_urls": [
        "http://demo.example.com/",
        "http://demo.example.com/city-picker.html",
        "http://demo.example.com/mismatch.html"
      ],
      "measurements": {
        "pages_with_canonical": 5,
        "conflicts": 2,
        "priority_score": 0.5251,
        "affected_surface": 0.85
      },
      "effort": "small",
      "suggested_action": {
        "summary": "Point each page's rel=canonical at its own live, preferred URL.",
        "implementation": [
          "Set rel=canonical to the page's own absolute HTTPS URL unless it is a genuine duplicate.",
          "Where pages truly duplicate one another, keep the canonical but make the duplicate's content identical, or differentiate the content and give each its own canonical.",
          "Remove canonicals pointing at URLs that do not return 200."
        ],
        "why_it_works": "Canonical is the machine's identity assertion for a document; making it self-consistent gives every citable page exactly one resolvable address.",
        "verification": "Fetch each affected page, confirm the canonical resolves to a 200 URL that serves the same content, and re-run the audit.",
        "priority": "P0"
      }
    },
    {
      "id": "F-003",
      "defect_id": "FI-001",
      "detector": "entity_name_inconsistency",
      "title": "The site names its own brand inconsistently",
      "category": "fact-integrity",
      "stage": "IDENTIFY",
      "failure_mode": "ambiguous",
      "severity": "high",
      "priority": "P1",
      "confidence": 0.85,
      "evidence_level": "corroborated",